{
  "$schema": "https://schema.agennext.dev/agent-fabric/meta/type-registry.schema.json",
  "id": "af:registry/core",
  "kind": "TypeRegistry",
  "version": "1.0.0",
  "nodeKinds": [
    { "name": "Agent", "schema": "https://schema.agennext.dev/agent-fabric/nodes/agent.schema.json", "description": "Autonomous software agent." },
    { "name": "Human", "schema": "https://schema.agennext.dev/agent-fabric/nodes/human.schema.json", "description": "Human participant." },
    { "name": "Team", "schema": "https://schema.agennext.dev/agent-fabric/nodes/team.schema.json", "description": "Group of agents/humans." },
    { "name": "Tool", "schema": "https://schema.agennext.dev/agent-fabric/nodes/tool.schema.json", "description": "Invocable capability." },
    { "name": "Skill", "schema": "https://schema.agennext.dev/agent-fabric/nodes/skill.schema.json", "description": "Reusable competency." },
    { "name": "Runtime", "schema": "https://schema.agennext.dev/agent-fabric/nodes/runtime.schema.json", "description": "Execution environment." },
    { "name": "Resource", "schema": "https://schema.agennext.dev/agent-fabric/nodes/resource.schema.json", "description": "Protected asset." },
    { "name": "Policy", "schema": "https://schema.agennext.dev/agent-fabric/nodes/policy.schema.json", "description": "Governance rule." },
    { "name": "Trace", "schema": "https://schema.agennext.dev/agent-fabric/nodes/trace.schema.json", "description": "Execution evidence pointer." },
    { "name": "Identity", "schema": "https://schema.agennext.dev/agent-fabric/nodes/identity.schema.json", "description": "Credentialed principal." },
    { "name": "Workspace", "schema": "https://schema.agennext.dev/agent-fabric/nodes/workspace.schema.json", "description": "Bounded context / partition." },
    { "name": "Channel", "schema": "https://schema.agennext.dev/agent-fabric/nodes/channel.schema.json", "description": "Communication channel mediating any parties." }
  ],
  "relationTypes": [
    { "name": "MEMBER_OF", "description": "Agent/Human is a member of a Team.", "domain": ["Agent", "Human"], "range": ["Team"], "cardinality": "many-to-many" },
    { "name": "OWNS", "description": "Identity/Human owns an entity.", "domain": ["Identity", "Human", "Team"], "range": ["Agent", "Resource", "Tool", "Skill", "Workspace"], "cardinality": "one-to-many" },
    { "name": "HAS_IDENTITY", "description": "Agent/Human is bound to an Identity.", "domain": ["Agent", "Human"], "range": ["Identity"], "inverseOf": "ASSUMES_IDENTITY", "cardinality": "many-to-many" },
    { "name": "ASSUMES_IDENTITY", "description": "Agent assumes/impersonates an Identity at runtime.", "domain": ["Agent"], "range": ["Identity"], "inverseOf": "HAS_IDENTITY", "cardinality": "many-to-many" },
    { "name": "USES", "description": "Agent uses a Tool or Skill.", "domain": ["Agent", "Skill"], "range": ["Tool", "Skill"], "cardinality": "many-to-many" },
    { "name": "INVOKES", "description": "Runtime-observed invocation of a Tool by an Agent.", "domain": ["Agent"], "range": ["Tool"], "cardinality": "many-to-many" },
    { "name": "DEPENDS_ON", "description": "Dependency between tools/skills/agents.", "domain": ["Tool", "Skill", "Agent"], "range": ["Tool", "Skill", "Agent"], "transitive": true, "cardinality": "many-to-many" },
    { "name": "PROVIDES", "description": "Tool/Runtime provides a Skill or Resource.", "domain": ["Tool", "Runtime", "Agent"], "range": ["Skill", "Resource"], "cardinality": "one-to-many" },
    { "name": "RUNS_ON", "description": "Agent runs on a Runtime.", "domain": ["Agent"], "range": ["Runtime"], "inverseOf": "DEPLOYED_IN", "cardinality": "many-to-one" },
    { "name": "DEPLOYED_IN", "description": "Runtime is deployed in a Workspace.", "domain": ["Runtime", "Agent"], "range": ["Workspace"], "cardinality": "many-to-one" },
    { "name": "SCOPED_TO", "description": "Entity is scoped to a Workspace.", "domain": [], "range": ["Workspace"], "cardinality": "many-to-one" },
    { "name": "GOVERNED_BY", "description": "Subject is governed by a Policy.", "domain": ["Agent", "Human", "Team", "Tool", "Resource", "Workspace"], "range": ["Policy"], "cardinality": "many-to-many" },
    { "name": "GRANTS", "description": "Policy grants access to a Resource.", "domain": ["Policy"], "range": ["Resource", "Tool"], "cardinality": "many-to-many" },
    { "name": "ACCESSES", "description": "Agent accesses a Resource.", "domain": ["Agent"], "range": ["Resource"], "cardinality": "many-to-many" },
    { "name": "TRUSTS", "description": "Trust edge between agents/identities.", "domain": ["Agent", "Identity", "Human"], "range": ["Agent", "Identity", "Human"], "cardinality": "many-to-many" },
    { "name": "DELEGATES_TO", "description": "Agent delegates a task/authority to another agent.", "domain": ["Agent", "Human"], "range": ["Agent"], "cardinality": "many-to-many" },
    { "name": "COMMUNICATES_WITH", "description": "Direct interaction between any two parties.", "domain": ["Agent", "Human", "Team"], "range": ["Agent", "Human", "Team"], "symmetric": true, "cardinality": "many-to-many" },
    { "name": "COLLABORATES_WITH", "description": "Team-to-team collaboration.", "domain": ["Team"], "range": ["Team"], "symmetric": true, "cardinality": "many-to-many" },
    { "name": "PARTICIPATES_IN", "description": "A party participates in a communication Channel — one node connecting any parties.", "domain": ["Agent", "Human", "Team"], "range": ["Channel"], "cardinality": "many-to-many" },
    { "name": "PRODUCED", "description": "Agent produced a Trace.", "domain": ["Agent", "Team"], "range": ["Trace"], "cardinality": "one-to-many" },
    { "name": "EVIDENCED_BY", "description": "An assertion is evidenced by a Trace.", "domain": [], "range": ["Trace"], "cardinality": "many-to-many" },
    { "name": "DERIVED_FROM", "description": "Entity/relation derived/inferred from another.", "domain": [], "range": [], "transitive": true, "cardinality": "many-to-many" }
  ]
}
